{
  "schema_version": "1.1",
  "project": {
    "id": "example-project",
    "title": "Example source",
    "source_name": "Example — Episode 1",
    "source_language": "ja",
    "output_language": "pt-BR"
  },
  "defaults": {
    "video": {
      "width": 1080,
      "height": 1920,
      "aspect_ratio": "9:16",
      "reframe": {
        "mode": "center_crop"
      }
    },
    "audio": {
      "normalize": true,
      "target_lufs": -16,
      "true_peak": -1.5
    },
    "voice": {
      "engine": "sapi",
      "voice": null,
      "rate": 1.0,
      "volume": 1.0
    },
    "captions": {
      "enabled": true,
      "mode": "narration",
      "source_dialogue": false,
      "max_lines": 2,
      "max_chars_per_line": 34
    },
    "hook": {
      "enabled": true,
      "duration": 2.2
    },
    "source_label": {
      "enabled": true,
      "show_last_seconds": 2.0
    }
  },
  "shorts": [
    {
      "id": "short-01",
      "enabled": true,
      "editorial": {
        "content_mode": "commentary",
        "title": "Exemplo",
        "hook_text": "Foi aqui que tudo mudou.",
        "source_label_text": "Example — Episode 1"
      },
      "timeline": [
        {
          "id": "seg-01",
          "type": "source_clip",
          "start": "00:01:00.000",
          "end": "00:01:06.000",
          "source_audio": {
            "mode": "duck",
            "duck_db": -16
          },
          "voiceover": {
            "enabled": true,
            "text": "Esse começo cria uma sensação de segurança que dura muito pouco."
          }
        },
        {
          "id": "seg-02",
          "type": "source_clip",
          "start": "00:02:10.000",
          "end": "00:02:17.000",
          "source_audio": {
            "mode": "keep"
          },
          "voiceover": {
            "enabled": false
          }
        },
        {
          "id": "seg-03",
          "type": "source_clip",
          "start": "00:03:20.000",
          "end": "00:03:27.000",
          "source_audio": {
            "mode": "duck",
            "duck_db": -16
          },
          "voiceover": {
            "enabled": true,
            "text": "E é aqui que a história muda completamente de tom."
          }
        }
      ],
      "publishing": {
        "approved": false,
        "platforms": {
          "youtube": {
            "enabled": false,
            "title": "Exemplo",
            "description": "",
            "tags": [],
            "schedule_at": null
          }
        }
      }
    }
  ],
  "publishing": {
    "enabled": false,
    "approval_required": true,
    "default_timezone": "America/Sao_Paulo"
  },
  "compatibility": {
    "allow_unknown_fields": true,
    "minimum_app_version": "0.2.0"
  }
}